,date of report,date of incident,time of incident,location,description,kind of incident,gender of victim,,university campus?,number of companions,environmental factors ,Has this been reported to the police?,human verified
14,2022-03-23 14:56:43,2022-03-22,21:15:00,"13.09887,77.571113","A man on a bike... ""slapped my ass"" and drove past. I had pepper spray in my hand but he went away before I could see his face, note the bike no. Or use my weapon",Harassment,Female,,No,0,The street lights were not functioning,,yes
15,2022-03-23 16:36:47,2022-03-23,22:04:00,,A man pinched my ass ,Harassment,Female,,,,,,no
16,2022-03-23 19:09:20,2022-03-24,10:10:00,"13.100211,77.574213","A friend and i were walking in a street near the Sandhya Pg mess when a man on a bike (he wore a black jacket, had short black hair, was dark and the bike had a red end), pinched my ass and sped off. Later on, he was seen outside my pg while i was returning home by my friend who dropped me home. ",Groping,Female,,,,,,yes
18,2022-03-24 03:42:43,2022-03-23,21:55:00,"13.100775,77.573197","I was walking on the road with a friend and a guy in black jacket, short black hair rode past us on his bike, and groped my friend while we were walking ",Groping,Female,,,,,,no
20,2022-03-31 17:46:00,2022-03-26,22:30:00,"13.098947,77.572038","My friend and I were walking to House 40 at 10pm, we were quite alert about a white sports bike following us, but when we almost approached the house, we noticed he had slowed down, and was inches away from groping us. We were able to dodge the attack, and he immediately fled.",Groping,Female,,,,,,yes
21,2022-03-31 17:48:55,2022-03-26,22:15:00,"13.104036,77.573079",Me and two of my friends were followed by a man in a black honda city  DL10CK2303 . The man kept making rounds again and again and would stop near us. The car stopped outside H.N. 112 since were standing outside ,Stalking,Female,,,,,,yes
22,2022-03-31 17:50:58,2022-03-18,20:00:00,"13.099051,77.572242","A man , probably drunk or high followed me while making odd noises ",Stalking,Female,,,,,,yes
23,2022-04-03 18:04:42,2022-04-03,22:15:00,"13.09818,77.571695","I was standing with two three of my friends on the footpath. An obviously drunk man was walking towards us and began to approach us. We started walking away but he continued to follow us and blatantly kept coming closer. At some point, we were half-running and saw him laughing at us being scared. We finally asked the NCC guards if we could stand inside and they let us. But the drunk man continued to hand around and try and approach us. When he was asked to go away he pretended to make calls which we could see while hanging around and the guards let him sit with them for a while which made us even more uncomfortable.",Stalking,Female,,No,3,It was secluded,,yes
24,2022-04-04 06:36:34,2022-04-03,22:20:00,"13.097129,77.57068",A drunk man followed us for a while and even though we went inside the gate of NCC he found a chair and sat outside before walking away and circling back,Stalking,Female,,No,3,,,"no, duplicate report"
25,2022-04-05 18:14:33,2022-04-05,22:25:00,"13.099874,77.570774",My friend and I were walking back home at around 10:20pm and I saw a man wearing a blue checked shirt peeing behind a tree. He saw me looking at him. I looked away and i was just walking further ahead on that road. The man came behind in fast speed on his bike and spanked me and rushed past,Harassment,Female,,,,,,yes
26,2022-04-07 18:28:56,2022-04-01,23:00:00,"13.102619,77.571794","a dark coloured Honda car followed us, circled the place where we were standing about 5-6 times, rolled down the window around us and yelled obscenities at us and then parked the car about 5 mtrs away from us and stared at us. Number plate: DL 10 CK 2303",Harassment,Female,,No,1,,,yes
27,2022-04-08 05:23:37,2022-04-08,09:35:00,"13.106,77.573991","A middle aged man on a scooter slowed down beside me and asked if I wanted a drop somewhere. When I shook my head and continued to walk forward, he sped up and slowed down next to me again and asked I was tee to talk. I continued to walk and he left.",Harassment,Female,,,,,,yes
29,2022-04-08 06:29:35,2022-03-22,18:00:00,"13.104981,77.572988",2 men on the bike threw something on me from a bottle. The bike didn’t stop so I couldn’t see any number but I could see they were laughing.,Harassment,Female,,,,,,yes
30,2022-04-24 16:40:11,2022-04-24,13:09:00,"13.105979,77.574046","I was riding my cycle at around 1 noon back to my pg, I was coming from the direction of the n5 campus and my pg is close to the taste of india restaurant. So when I turned in that right turn to take that road, I immediately noticed that there were group of me, possibly drunk, possibly, and one of then tried to intercept my way. He stuck his hand out as if he was asking for a ride and kept asking me to stop. He saw me drivert from a longer distance and tried intercept again. I was riding fast so as the distance between us reduced I could quickly take a bigger diversion and avoid any physical contact, or crash. There were other people on the road they did notice what was going on but said nothing about it. After I crossed them I heard one of the other men say that ""forget it she's wearing headphones"" in kannada, I heard it because I didn't have any music on and the cord was not even connected to my phone. I quickly reached my pg and reported on the whatsApp group but it was a scary moment because God forbid it was a narrow road I would been in a much much worse situation, without being able to take that divertion. I feel I narrowing escaped a very ugly incident. ",Catcalling,Female,,,,,,yes
31,2022-04-25 13:41:53,2022-04-24,18:11:00,"13.100127,77.572442",,"Stalking,Indecent exposure",Female,,,,,,
32,2022-04-25 14:59:10,2022-04-07,22:20:00,"13.101284,77.574063","A man on a motorcycle kept going past us on our walk, almost 2-3 times during a 1 hour long walk. Eventually, he slowed down near us and groped by butt and sped away. On instict, I yelled at him and ran behind him but he was too fast and he went out of sight within a matter of seconds. ","Harassment,Rape/Assault,Stalking,Groping",Female,,No,1,It was secluded,,yes
33,2022-05-27 13:43:28,2022-05-11,02:34:00,"13.095827,77.573757",asdfasd,Harassment,I prefer not to say,,,,,,
34,2022-08-19 17:54:57,2022-08-17,19:45:00,"13.102615,77.571759","I kind of remember seeing the person’s face before, we were sitting near freshmart on one of the benches. There was 4 of us. One of the guy with blond hair streaks kept on looking over and smiling at me. I was scared because my friend kept on saying my name. Then when I went into freshmart, I stayed inside because I thought he might go away, but when I came out he was still there and standing advancing towards me. That is when I sped walk  in the opposite direction.  ",Stalking,Female,,,,,,yes
35,2022-08-22 08:53:24,2022-08-16,21:10:00,"13.103221,77.5717",We were walking in a group of 4 (all girls).  A group of 3 boys on a scooter passed us on the right while yelling something along the lines of 'hey baby' while making eye contact.,Catcalling,Female,,No,4,,,yes
36,2022-09-01 07:46:26,2022-09-01,08:45:00,"13.081392,77.581175",A man threw an egg at me,Harassment,I prefer not to say,,No,3,It was secluded,,no (test report)
37,2022-09-01 17:10:52,2022-09-01,22:15:00,"13.100145,77.573497","When I was walking with two of my friends, this dude in a scooter comes from the back, grabs me and passed by.",Harassment,Female,,,,,,yes
38,2022-09-06 14:34:55,2022-08-29,19:30:00,"13.102033,77.570578","I was walking from my pg to the mess with 2 other people  when a bike came up behind us after slowing down so that we didn't hear hear him. He groped me, continued to ride ahead while looking back, smiling and flipping us off.",Groping,Female,,No,2,"It was secluded,Cannot say definitively",,yes
39,2022-09-08 15:48:31,2022-09-08,21:00:00,"13.101888,77.573116","A hey guys, a creepy man (possibly drunk) on a cycle followed us for a bit and stopped next to us and tried to whisper something in our ears. He came in very close proximity to us, and circled around our pg for a bit. This was near mahaveer and around the sandhya mess. He was wearing a blue shirt. Just be careful.","Harassment,Stalking,Catcalling",Female,,No,1,Cannot say definitively,,yes
40,2022-09-09 03:26:56,2022-09-06,20:40:00,"13.102285,77.571722",2guys on an activa were  cat calling me and when I reacted the took a u turn and they started following me I started running into fresh mart one of the guy got down then I saw one of my friends I ran out of the fresh mart and told her I needed help she started recording and the guy left covering his face. The we’re on a white activa and the scooty number was either 6612 or 6621,Catcalling,Female,,,,,,yes
41,2022-09-10 15:34:06,2022-09-09,15:00:00,"13.103297,77.576972","I was walking back home from college and on the Royalmart main road, right in front of the bus station next to Krishna upachar darshini. it was around 3pm and a man on a scooty slowed down while riding towards me and when he passed me, he screamed at me in kannada ",Catcalling,Female,,,,,,no
42,2022-09-23 13:49:23,2022-09-23,19:00:00,"13.105899,77.572908","We were returning from Kun. Five guys were sitting on a bench in front of the bus stand. They were staring hard when we walked past. Then my friend noticed they were following us.  We crossed the road to the other side to just confirm and they crossed as well.  But by this time we had almost reached our pg. When we looked back this time, they had vanished.  We suspect they had noticed us us keeping an eye ",Stalking,Female,,No,1,Cannot say definitively,,yes
43,2022-10-18 15:41:39,2022-10-18,20:55:00,"13.099386,77.576726",Catcalling,"Harassment,Catcalling,I felt unsafe",Male,,,,,,yes
44,2022-10-22 17:32:26,2022-08-19,23:00:00,"13.102664,77.57146","A man on a scooter speeding by while I was walking, leaned towards me, either to grab my phone or touch me.","Groping,I felt unsafe",Female,,No,4,Cannot say definitively,,yes
45,2022-11-02 04:10:20,2022-11-02,00:00:00,"12.938524,77.632302",Witnessed a stabbing ,Harassment,Male,,,,,,yes
46,2022-11-02 05:05:29,2019-11-22,12:20:00,"12.916841,77.597492",I was mugged by two people who were in a scooty.,"Harassment,Stalking,I felt unsafe, Theft",Male,,No,0,"The street lights were not functioning,It was secluded",,yes
47,2022-11-02 05:45:17,2022-02-23,21:30:00,"12.912418,77.635145",Phone snatching,"I felt unsafe, Theft",Male,,No,0,Cannot say definitively,,yes
48,2022-11-02 10:38:11,2022-10-26,01:00:00,"12.978912,77.640743",Local drunk fellow started cursing in kannada saying north indian,"Harassment,I felt unsafe",Male,,,,,,yes
49,2022-11-06 16:35:17,2022-11-06,20:24:00,"12.977382,77.572169",We were getting on. Bus from majestic. Free i got on. A man had followed us and he stood next to the window tapping the glass and trying to get my attention. Initially I thought he was going to sk something but he just made a kissing face so I tried to ignore him. Then he put his hand in through the open window I hadn't noticed and tried to touch me. I slapped his hand way and yelled out loud but he just walked away and I'm still shivering out of fear.,"Harassment,Groping",Female,,No,2,The street lights were not functioning,,yes
50,2022-11-06 18:40:14,2022-11-04,21:30:00,"13.098456,77.581437",I was walking and this random guy calls me and then starts asking for my Instagram I’d ,I felt unsafe,Female,,,,,,yes
51,2022-11-08 13:59:48,2022-11-08,18:00:00,"13.132979,77.598324","My friend got groped by a 10-13 year old kid named Sachin Suhaas on a red cycle today evening just outside Anitha Pg 96 building. On interrogation, he said that he lives in 4th phase opposite a bhajji shop.  ",Harassment,Female,,,,,No,yes
52,2022-11-10 07:36:19,2022-10-20,02:05:00,"12.960425,77.64459",Got Picked and Beaten by some drunk fellow at night,"Harassment,Rape/Assault",Male,,,,,Yes,yes
53,2022-11-10 16:02:58,2019-11-30,09:25:00,"12.952723,77.499962",,Harassment,Male,,,,,No,yes
54,2022-12-02 04:19:02,2022-11-30,17:10:00,"13.107037,77.568864","Queens mead PG, Umesh 91",Indecent exposure,Female,,,,,No,yes
55,2022-12-04 23:35:59,2022-12-02,08:00:00,"12.977596,77.573411",Early morning when i was going to catch a bus..i was in hurry..near that starting in the corner there was a man sleeping naked ,I felt unsafe,Female,,,,,No,yes
58,2022-12-06 16:55:44,2022-12-06,22:05:00,"13.103858,77.574463","guys were going on a bike, slowed down near me, whistled at me and drove off.",Catcalling,Female,,,,,No,yes
59,2022-12-29 19:12:28,2022-08-19,03:30:00,"13.064585,77.593191",On a semi-crowded bus from Mekhri circle to NES.  We (Friend and I) were standing . Someone slammed into me on purpose. Was trying to hold my chest but I changed my angle and he was unsuccessful. Slammed into my hip hard and literally grabbed me.  My friend (guy) silently changed our positions a bit  immediately so that  the guy couldn't even see me after that.,"Harassment,Groping",Female,,No,1,,No,yes
60,2023-02-12 08:20:49,2023-01-24,17:50:00,"12.964782,77.596725","While I was walking back to my pg from college, this guy had been following me for quite some time, I didn't think much of it and just kept going, But while crossing the road at Richmond circle,  he grabbed my ass. I was quick to react, I shouted at him and dragged him to the traffic police who was nearby",Harassment,Female,,No,0,Cannot say definitively,Yes,yes
61,2023-02-12 12:10:01,2020-02-12,18:24:00,"12.924979,77.590421",One of the guys on the road flashed while I was sitting and waiting for my friend.,Indecent exposure,Female,,No,,,No,yes
62,2023-04-09 10:10:03,2023-02-12,14:30:00,"12.9779291,77.5929662","2 men stared a lot, one with long beard. Then they approached another girl sitting under a tree, asked her what she is reading, where is her home. Made her uncomfortable, she sweared to not come again.","Harassment,Stalking,I felt unsafe",Female,,,,,No,yes
63,2023-04-09 10:12:47,2020-04-26,15:00:00,Garuda mall,"One guy approached me, asked my name, told am pretty and was not backing off, even went up on escalater, had to threaten him with a slap warning if he doesn't stop","Harassment,Stalking,I felt unsafe",Female,,,,,No,yes